<?xml version = "1.0" encoding = "UTF-8" standalone = "no" ?>
<!DOCTYPE tasks SYSTEM 'tasks.dtd'>
<tasks>
    <task>
        <text>prueba</text>
    </task>
    <task>
        <text>prueba</text>
    </task>
    <task>
        <text>prueba</text>
    </task>
    <task>
        <text>prueba</text>
    </task>
    <task>
        <text>prueba</text>
    </task>
    <task>
        <text>prueba</text>
    </task>
    <task>
        <text>prueba</text>
    </task>
    <task>
        <text>prueba</text>
    </task>
    <task>
        <text>prueba</text>
    </task>
    <task>
        <text>prueba</text>
    </task>
    <task>
        <text>prueba</text>
    </task>
    <task>
        <text>prueba</text>
    </task>
    <task>
        <text>prueba</text>
    </task>
    <task>
        <text>prueba</text>
    </task>
    <task>
        <text>prueba</text>
    </task>
</tasks>